{
  "citation": "",
  "device": {
    "behavior_tags": [
      "binary",
      "nonvolatile"
    ],
    "custom_tags": [
      "template:fram-capacitor-2t"
    ],
    "device_id": "fram-capacitor-2t-example",
    "material_tags": [
      "ferroelectric-oxide"
    ],
    "mechanism_tags": [
      "ferroelectric"
    ],
    "notes": "This is a capacitor test structure, not automatically a complete 1T1C cell. Polarization/PUND analysis is outside the current pulse-conductance core.",
    "platform_tags": [
      "capacitor",
      "two-terminal"
    ],
    "technology_tags": [
      "fram"
    ],
    "terminal_count": 2
  },
  "experiment": {
    "instrument": "",
    "notes": "",
    "profile": "polarization",
    "source_format": "canonical-csv",
    "temperature_k": null
  },
  "license": "",
  "schema_version": "0.2.0",
  "source_url": ""
}
