{
  "citation": "",
  "device": {
    "behavior_tags": [
      "nonvolatile"
    ],
    "custom_tags": [
      "template:rram-2t"
    ],
    "device_id": "rram-2t-example",
    "material_tags": [
      "oxide"
    ],
    "mechanism_tags": [
      "unknown"
    ],
    "notes": "Template only: verify terminal count, mechanism, materials, and behavior for the actual measured DUT before publication.",
    "platform_tags": [
      "resistor",
      "two-terminal"
    ],
    "technology_tags": [
      "rram"
    ],
    "terminal_count": 2
  },
  "experiment": {
    "instrument": "",
    "notes": "",
    "profile": "pulse-update",
    "source_format": "canonical-csv",
    "temperature_k": null
  },
  "license": "",
  "schema_version": "0.2.0",
  "source_url": ""
}
